{
  "protocol_version": 1,
  "system_id": "cerebro-base",
  "name": "Cérebro Base",
  "version": "0.3.0",
  "status": "confirmed",
  "result": {
    "statement": "uma fonte real vira contexto aprovado que volta a trabalhar sem reexplicação",
    "non_success": "clonar a pasta, responder formulário ou organizar arquivos sem output útil",
    "output_type": "cerebro-base-ativado",
    "definition_of_done": "o dono usaria o primeiro output e uma segunda tarefa reaproveita o contexto salvo sem reler o bruto",
    "owner": "dono-do-cerebro",
    "human_gate": "confirmar recorte observado, output, correção e reutilização"
  },
  "trigger": {
    "type": "manual",
    "description": "primeira ativação do Cérebro Base ou retomada antes de T4"
  },
  "capability": {
    "capability_id": "ativar-recorte-operacional",
    "version": "0.1.0",
    "origin": "inevita"
  },
  "entities": [],
  "sources": [
    {
      "role": "evidencia-operacional",
      "source_id": null,
      "required": true,
      "access": "manual",
      "freshness": "caso real recente",
      "purpose": "provar o mapa atual e o primeiro output"
    }
  ],
  "pipeline": [
    { "state": "orientado", "input": "declaração e topologia", "output": "Mapa da empresa V0 e fontes registradas", "gate": "registro não abriu nem conectou fonte" },
    { "state": "observado", "input": "fonte mínima autorizada", "output": "recorte verificado", "gate": "escopo e proveniência explícitos" },
    { "state": "usado", "input": "CONFIGURAÇÃO da ativação", "output": "primeiro output e Run Record", "gate": "dono usaria o output" },
    { "state": "reutilizado", "input": "contexto aprovado", "output": "segunda saída e T4", "gate": "sem releitura do bruto nem reexplicação" }
  ],
  "permissions": {
    "read": ["fontes autorizadas"],
    "write": ["arquivos locais do cérebro"],
    "external_actions": false
  },
  "eval": {
    "version": "0.3.0",
    "deterministic_gates": ["sem invenção", "proveniência", "fronteira local"],
    "human_questions": ["Você usaria isso do jeito que está?", "Foi necessário explicar tudo de novo?"],
    "outcome_measure": "approved-context-reused",
    "baseline": null
  },
  "learning": {
    "correction_policy": "candidate-first",
    "promotion_threshold": 3,
    "requires_replay": true,
    "requires_human_approval": true
  },
  "extensions": {
    "product_kind": "brain-native",
    "surface": "brain",
    "operating_area": "operations-technology",
    "business_function": "data-technology"
  }
}
